Paper Name,PDF Link
Fabrica: Dual-Arm Assembly of General Multi-Part Objects via Integrated Planning and Learning,http://arxiv.org/pdf/2506.05168v1
LiPo: A Lightweight Post-optimization Framework for Smoothing Action Chunks Generated by Learned Policies,http://arxiv.org/pdf/2506.05165v1
Realizing Text-Driven Motion Generation on NAO Robot: A Reinforcement Learning-Optimized Control Pipeline,http://arxiv.org/pdf/2506.05117v1
DemoSpeedup: Accelerating Visuomotor Policies via Entropy-Guided Demonstration Acceleration,http://arxiv.org/pdf/2506.05064v1
Hierarchical Language Models for Semantic Navigation and Manipulation in an Aerial-Ground Robotic System,http://arxiv.org/pdf/2506.05020v1
GEX: Democratizing Dexterity with Fully-Actuated Dexterous Hand and Exoskeleton Glove,http://arxiv.org/pdf/2506.04982v1
"ArtVIP: Articulated Digital Assets of Visual Realism, Modular Interaction, and Physical Fidelity for Robot Learning",http://arxiv.org/pdf/2506.04941v1
